{
  "$schema": "https://json-schema.org/draft/2020-12/schema",
  "$id": "https://schemas.kumwe.org/studio/v1/authoring-target.schema.json",
  "title": "Studio contextual authoring target declaration",
  "description": "A bounded host-core or extension declaration that makes one class of host resources eligible for contextual Studio authoring. Discovery never grants authority.",
  "$ref": "#/$defs/declaration",
  "$defs": {
    "presentationState": {
      "enum": ["inline", "minimized", "maximized", "fullscreen"]
    },
    "saveOutcome": {
      "enum": ["save-item", "save-new-type-version", "save-as-new-type"]
    },
    "startKind": {
      "enum": ["blank", "from-type", "existing"]
    },
    "eligibility": {
      "enum": ["create", "edit"]
    },
    "capabilityRequirement": {
      "type": "object",
      "additionalProperties": false,
      "required": ["id", "versions"],
      "properties": {
        "id": { "$ref": "common.schema.json#/$defs/qualifiedName" },
        "versions": { "$ref": "common.schema.json#/$defs/versionRange" }
      }
    },
    "contributionDependency": {
      "type": "object",
      "additionalProperties": false,
      "required": ["kind", "id", "versions", "required"],
      "properties": {
        "kind": {
          "enum": [
            "block-definition",
            "pattern",
            "field-adapter",
            "inspector",
            "design-vocabulary",
            "migration"
          ]
        },
        "id": { "$ref": "common.schema.json#/$defs/qualifiedName" },
        "versions": { "$ref": "common.schema.json#/$defs/versionRange" },
        "required": { "type": "boolean" }
      }
    },
    "declaration": {
      "type": "object",
      "additionalProperties": false,
      "required": [
        "contractVersion",
        "kind",
        "id",
        "owner",
        "label",
        "surface",
        "resourceTypes",
        "eligibility",
        "modes",
        "startKinds",
        "presentationStates",
        "saveOutcomes",
        "requiredCapabilities",
        "contributionDependencies"
      ],
      "properties": {
        "contractVersion": { "$ref": "common.schema.json#/$defs/contractVersion" },
        "kind": { "const": "authoring-target" },
        "id": { "$ref": "common.schema.json#/$defs/qualifiedName" },
        "owner": { "$ref": "common.schema.json#/$defs/ownerReference" },
        "label": { "$ref": "common.schema.json#/$defs/messageReference" },
        "surface": { "$ref": "common.schema.json#/$defs/qualifiedName" },
        "resourceTypes": {
          "type": "array",
          "minItems": 1,
          "maxItems": 100,
          "uniqueItems": true,
          "items": { "$ref": "common.schema.json#/$defs/qualifiedName" }
        },
        "eligibility": {
          "type": "array",
          "minItems": 1,
          "maxItems": 2,
          "uniqueItems": true,
          "items": { "$ref": "#/$defs/eligibility" }
        },
        "modes": {
          "type": "array",
          "minItems": 1,
          "maxItems": 3,
          "uniqueItems": true,
          "items": { "enum": ["model", "blueprint", "content"] }
        },
        "startKinds": {
          "type": "array",
          "minItems": 1,
          "maxItems": 3,
          "uniqueItems": true,
          "items": { "$ref": "#/$defs/startKind" }
        },
        "presentationStates": {
          "type": "array",
          "minItems": 1,
          "maxItems": 4,
          "uniqueItems": true,
          "items": { "$ref": "#/$defs/presentationState" }
        },
        "saveOutcomes": {
          "type": "array",
          "minItems": 1,
          "maxItems": 3,
          "uniqueItems": true,
          "items": { "$ref": "#/$defs/saveOutcome" }
        },
        "requiredCapabilities": {
          "type": "array",
          "maxItems": 100,
          "items": { "$ref": "#/$defs/capabilityRequirement" }
        },
        "contributionDependencies": {
          "type": "array",
          "maxItems": 500,
          "items": { "$ref": "#/$defs/contributionDependency" }
        },
        "extensions": { "$ref": "common.schema.json#/$defs/extensions" }
      }
    },
    "resolveRequest": {
      "type": "object",
      "additionalProperties": false,
      "required": ["targetId", "intent", "resourceContext"],
      "properties": {
        "targetId": { "$ref": "common.schema.json#/$defs/qualifiedName" },
        "intent": { "$ref": "#/$defs/eligibility" },
        "resourceContext": { "$ref": "common.schema.json#/$defs/resourceContext" },
        "requestedPresentation": { "$ref": "#/$defs/presentationState" }
      }
    },
    "resolution": {
      "type": "object",
      "additionalProperties": false,
      "required": ["target", "resourceContext", "availableStarts", "initialPresentation"],
      "properties": {
        "target": { "$ref": "#/$defs/declaration" },
        "resourceContext": { "$ref": "common.schema.json#/$defs/resourceContext" },
        "availableStarts": {
          "type": "array",
          "minItems": 1,
          "maxItems": 3,
          "uniqueItems": true,
          "items": { "$ref": "#/$defs/startKind" }
        },
        "initialPresentation": { "$ref": "#/$defs/presentationState" },
        "returnContext": { "$ref": "common.schema.json#/$defs/returnContext" }
      }
    }
  }
}
